{
  "task_id": "REPLACE_WITH_UNIQUE_TASK_ID",
  "engineering_state": "S6",
  "repo_root": "REPLACE_WITH_ABSOLUTE_PATH_TO_YOUR_BMS_GIT_REPOSITORY",
  "source_revision": "REPLACE_WITH_EXACT_CHECKED_OUT_GIT_COMMIT",
  "requirement_set_version": "REPLACE_WITH_APPROVED_REQUIREMENT_VERSION",
  "configuration_id": "CFG-REPLACE_WITH_CONFIGURATION_VERSION",
  "artifacts": [
    "REPLACE_WITH_RELATIVE_MODEL_OR_SOURCE_PATH",
    "REPLACE_WITH_RELATIVE_PARAMETER_PATH",
    "REPLACE_WITH_RELATIVE_CALIBRATION_PATH"
  ],
  "expected_artifact_hashes": {
    "REPLACE_WITH_RELATIVE_MODEL_OR_SOURCE_PATH": "0000000000000000000000000000000000000000000000000000000000000000",
    "REPLACE_WITH_RELATIVE_PARAMETER_PATH": "0000000000000000000000000000000000000000000000000000000000000000",
    "REPLACE_WITH_RELATIVE_CALIBRATION_PATH": "0000000000000000000000000000000000000000000000000000000000000000"
  },
  "output_artifacts": [
    "REPLACE_WITH_GENERATED_SIL_CODE_PATH",
    "REPLACE_WITH_SIL_BUILD_OUTPUT_PATH"
  ],
  "configuration": {
    "target": "SIL",
    "matlab_version": "REPLACE_WITH_INSTALLED_MATLAB_VERSION",
    "simulink_version": "REPLACE_WITH_INSTALLED_SIMULINK_VERSION",
    "toolchain": "REPLACE_WITH_APPROVED_TOOLCHAIN",
    "test_harness": "REPLACE_WITH_APPROVED_HARNESS_PATH_OR_ID"
  },
  "approvals": {
    "configuration": {
      "approval_id": "REPLACE_WITH_CONFIGURATION_APPROVAL_ID",
      "actor": "REPLACE_WITH_APPROVER_ID",
      "role": "REPLACE_WITH_APPROVER_ROLE",
      "approved_at": "2026-01-01T00:00:00Z",
      "scope": "CFG-REPLACE_WITH_CONFIGURATION_VERSION"
    },
    "code_generation": {
      "approval_id": "REPLACE_WITH_CODE_GENERATION_APPROVAL_ID",
      "actor": "REPLACE_WITH_APPROVER_ID",
      "role": "REPLACE_WITH_APPROVER_ROLE",
      "approved_at": "2026-01-01T00:00:00Z",
      "scope": "SIL code generation"
    }
  },
  "validation_status": "not_performed"
}
